{
  "$schema": "https://rangers-strike.dev/schema/card.schema.json",
  "id": "RS-444",
  "name": "バトルケニア",
  "type": "unit",
  "category": "ET",
  "rarity": "NR",
  "expansion": "legend1",
  "powerCost": 0,
  "text": "【トロピカルダンス】特徴「獣」を持つ自軍ユニットを3体まで選び、ラッシュエリアに戻してもよい。ただし、戻したユニットはこのターン、再びバトルエリアに出ることはできない。",
  "rawText": "【トロピカルダンス】特徴「獣」を持つ自軍ユニットを3体まで選び、ラッシュエリアに戻してもよい。ただし、戻したユニットはこのターン、再びバトルエリアに出ることはできない。",
  "bp": 3000,
  "size": "S",
  "comboNumber": 4,
  "features": [
    "ブラック",
    "男"
  ],
  "effects": [
    {
      "id": "toropikarudansu",
      "name": "トロピカルダンス",
      "text": "特徴「獣」を持つ自軍ユニットを3体まで選び、ラッシュエリアに戻してもよい。ただし、戻したユニットはこのターン、再びバトルエリアに出ることはできない。",
      "trigger": {
        "type": "while_in_field"
      },
      "effects": [
        {
          "type": "grant_keyword",
          "keyword": "effect_card::RS-444::toropikarudansu",
          "duration": "permanent"
        }
      ],
      "optional": true
    }
  ],
  "implementation": {
    "source": "dsl",
    "handler": "interpreter",
    "testGenerated": true
  },
  "imageUrl": "/cards/promoted/RS-444.jpg",
  "imageSourceUrl": "https://www.grnrngr.com/cards/rangers-strike/cards/RS-444.jpg"
}
