{
  "$schema": "https://rangers-strike.dev/schema/card.schema.json",
  "id": "XG6-050",
  "name": "仮面ライダーグレイブ",
  "type": "unit",
  "category": [
    "WB",
    "DA"
  ],
  "rarity": "SR",
  "expansion": "legend1",
  "powerCost": 1,
  "text": "※このユニットは特徴「アンデッド」を持つユニットをラッシュするためのコマンドとしてホールドできる。 【試させてもらいますよ】「SP1」お互いの手札が1枚以上あれば、次の効果を発動できる⇒自分の手札を1～3枚選び相手に見せてから、その必要パワーの数字を合計する。そうしたとき、相手も同じようにして、合計した数字が低い方に1点ダメージを与える。",
  "rawText": "※このユニットは特徴「アンデッド」を持つユニットをラッシュするためのコマンドとしてホールドできる。 【試させてもらいますよ】「SP1」お互いの手札が1枚以上あれば、次の効果を発動できる⇒自分の手札を1～3枚選び相手に見せてから、その必要パワーの数字を合計する。そうしたとき、相手も同じようにして、合計した数字が低い方に1点ダメージを与える。",
  "bp": 4000,
  "size": "S",
  "sp": "special",
  "comboNumber": 2,
  "features": [
    "仮面ライダー",
    "男"
  ],
  "effects": [
    {
      "id": "unnamed_e280bbe38193e381aee383a6",
      "text": "※このユニットは特徴「アンデッド」を持つユニットをラッシュするためのコマンドとしてホールドできる。",
      "trigger": {
        "type": "while_in_field"
      },
      "effects": [
        {
          "type": "grant_keyword",
          "keyword": "undead_command_rush_hold",
          "duration": "permanent"
        }
      ]
    },
    {
      "id": "sasetemoraimasuyo",
      "name": "試させてもらいますよ",
      "text": "「SP1」お互いの手札が1枚以上あれば、次の効果を発動できる⇒自分の手札を1～3枚選び相手に見せてから、その必要パワーの数字を合計する。そうしたとき、相手も同じようにして、合計した数字が低い方に1点ダメージを与える。",
      "trigger": {
        "type": "nc"
      },
      "effects": [
        {
          "type": "grant_keyword",
          "keyword": "SP1",
          "duration": "turn"
        },
        {
          "type": "grant_keyword",
          "keyword": "xg6::XG6-050::try",
          "duration": "permanent"
        }
      ],
      "optional": false
    }
  ],
  "implementation": {
    "source": "dsl",
    "handler": "interpreter",
    "testGenerated": true
  }
}
