{
  "$schema": "https://rangers-strike.dev/schema/card.schema.json",
  "id": "XG1-009",
  "name": "レッドマスク",
  "type": "unit",
  "category": "MA",
  "rarity": "N",
  "expansion": "legend1",
  "powerCost": 3,
  "text": "※スクラム 【マスキークラッシュ】SP1 これがストライクしてダメージを与えるとき、かわりに敵軍捨札を1枚選び持ち主のパワーゾーンにダメージにして置いてもよい。",
  "rawText": "※スクラム 【マスキークラッシュ】SP1 これがストライクしてダメージを与えるとき、かわりに敵軍捨札を1枚選び持ち主のパワーゾーンにダメージにして置いてもよい。",
  "bp": 3000,
  "size": "S",
  "sp": "special",
  "comboNumber": 3,
  "features": [
    "レッド",
    "男"
  ],
  "effects": [
    {
      "id": "unnamed_e280bbe382b9e382afe383a9",
      "text": "※スクラム",
      "trigger": {
        "type": "while_in_field"
      },
      "effects": [
        {
          "type": "grant_keyword",
          "keyword": "scrum",
          "duration": "permanent"
        }
      ]
    },
    {
      "id": "masukikurashu",
      "name": "マスキークラッシュ",
      "text": "SP1 これがストライクしてダメージを与えるとき、かわりに敵軍捨札を1枚選び持ち主のパワーゾーンにダメージにして置いてもよい。",
      "trigger": {
        "type": "nc"
      },
      "optional": false,
      "effects": [
        {
          "type": "grant_keyword",
          "keyword": "SP1",
          "duration": "turn"
        },
        {
          "type": "grant_keyword",
          "keyword": "xg1::XG1-009::masky_crash",
          "duration": "turn"
        }
      ]
    }
  ],
  "implementation": {
    "source": "dsl",
    "handler": "interpreter",
    "testGenerated": true
  }
}
