{
  "$schema": "https://rangers-strike.dev/schema/card.schema.json",
  "id": "RS-682",
  "name": "亀折神",
  "type": "unit",
  "category": "MA",
  "rarity": "N",
  "expansion": "legend1",
  "powerCost": 3,
  "text": "※レジスト ※これはアタックすることができない。 【堅牢なる甲羅】レジストを持つ自軍Mユニットを1体選び、リリースしてもよい。",
  "rawText": "※レジスト ※これはアタックすることができない。 【堅牢なる甲羅】レジストを持つ自軍Mユニットを1体選び、リリースしてもよい。",
  "bp": 6000,
  "size": "M",
  "comboNumber": 4,
  "features": [
    "獣",
    "折神獣"
  ],
  "effects": [
    {
      "id": "unnamed_register",
      "text": "※レジスト",
      "trigger": {
        "type": "while_in_field"
      },
      "effects": [
        {
          "type": "grant_keyword",
          "keyword": "register",
          "duration": "permanent"
        }
      ]
    },
    {
      "id": "unnamed_cannot_attack",
      "text": "※これはアタックすることができない。",
      "trigger": {
        "type": "while_in_field"
      },
      "effects": [
        {
          "type": "grant_keyword",
          "keyword": "cannot_attack",
          "duration": "permanent"
        }
      ]
    },
    {
      "id": "naru_ko",
      "name": "堅牢なる甲羅",
      "text": "レジストを持つ自軍Mユニットを1体選び、リリースしてもよい。",
      "trigger": {
        "type": "nc"
      },
      "effects": [
        {
          "type": "grant_keyword",
          "keyword": "set9d::RS-682::sturdy_shell",
          "duration": "turn"
        }
      ],
      "optional": false
    }
  ],
  "implementation": {
    "source": "dsl",
    "handler": "interpreter",
    "testGenerated": true
  },
  "imageUrl": "/cards/promoted/RS-682.jpg",
  "imageSourceUrl": "https://www.grnrngr.com/cards/rangers-strike/cards/RS-682.jpg"
}
