{
  "$schema": "https://rangers-strike.dev/schema/card.schema.json",
  "id": "SR-002",
  "name": "スーパーフォーメーション",
  "type": "operation",
  "category": "ET",
  "rarity": "SC",
  "expansion": "legend1",
  "powerCost": 6,
  "text": "このターン、5体以上の合体ユニットを必要とする特徴「メカ」を持つユニットのカードをラッシュするとき、追加条件を満たすために次のようにしてもよい⇒自軍コマンドゾーンのリリース状態のカードから、合体ユニットに足りない分のユニットと同じ名前のカードを捨札にする。",
  "rawText": "このターン、5体以上の合体ユニットを必要とする特徴「メカ」を持つユニットのカードをラッシュするとき、追加条件を満たすために次のようにしてもよい⇒自軍コマンドゾーンのリリース状態のカードから、合体ユニットに足りない分のユニットと同じ名前のカードを捨札にする。",
  "effects": [
    {
      "id": "supafuomeshon",
      "name": "スーパーフォーメーション",
      "text": "このターン、5体以上の合体ユニットを必要とする特徴「メカ」を持つユニットのカードをラッシュするとき、追加条件を満たすために次のようにしてもよい⇒自軍コマンドゾーンのリリース状態のカードから、合体ユニットに足りない分のユニットと同じ名前のカードを捨札にする。",
      "trigger": {
        "type": "operation",
        "timing": "rush"
      },
      "effects": [
        {
          "type": "grant_keyword",
          "keyword": "promo::SR-002::super_formation",
          "duration": "turn"
        }
      ],
      "optional": true
    }
  ],
  "implementation": {
    "source": "dsl",
    "handler": "interpreter",
    "testGenerated": true
  },
  "imageUrl": "/cards/promoted/SR-002.jpg",
  "imageSourceUrl": "https://www.grnrngr.com/cards/rangers-strike/cards/SR-002.jpg"
}
