{
  "$schema": "https://rangers-strike.dev/schema/card.schema.json",
  "id": "RS-493",
  "name": "六の槍サタラクラ",
  "type": "unit",
  "category": "DA",
  "rarity": "N",
  "expansion": "legend1",
  "powerCost": 6,
  "text": "【正解の無いクイズ】自軍パワーのダメージになっているカードを、ウラ向きのままシャッフルして置きなおしてもよい。そうしたとき、自軍パワーのダメージになっているカードを1枚選び、そのカードの必要パワーの数字を相手に宣言させてからオモテにする。相手の解答が不正解なら、相手に1点ダメージを与える。正解なら相手は自分自身のユニットを1体選び撃破する。その後オモテにしたカードを捨札にする。",
  "rawText": "【正解の無いクイズ】自軍パワーのダメージになっているカードを、ウラ向きのままシャッフルして置きなおしてもよい。そうしたとき、自軍パワーのダメージになっているカードを1枚選び、そのカードの必要パワーの数字を相手に宣言させてからオモテにする。相手の解答が不正解なら、相手に1点ダメージを与える。正解なら相手は自分自身のユニットを1体選び撃破する。その後オモテにしたカードを捨札にする。",
  "bp": 4000,
  "size": "S",
  "comboNumber": 6,
  "features": [
    "暗黒七本槍",
    "男",
    "忍者"
  ],
  "effects": [
    {
      "id": "noikuizu",
      "name": "正解の無いクイズ",
      "text": "自軍パワーのダメージになっているカードを、ウラ向きのままシャッフルして置きなおしてもよい。そうしたとき、自軍パワーのダメージになっているカードを1枚選び、そのカードの必要パワーの数字を相手に宣言させてからオモテにする。相手の解答が不正解なら、相手に1点ダメージを与える。正解なら相手は自分自身のユニットを1体選び撃破する。その後オモテにしたカードを捨札にする。",
      "trigger": {
        "type": "nc"
      },
      "effects": [
        {
          "type": "grant_keyword",
          "keyword": "set7c::RS-493::quiz",
          "duration": "turn"
        }
      ]
    }
  ],
  "implementation": {
    "source": "dsl",
    "handler": "interpreter",
    "testGenerated": true
  },
  "imageUrl": "/cards/promoted/RS-493.jpg",
  "imageSourceUrl": "https://www.grnrngr.com/cards/rangers-strike/cards/RS-493.jpg"
}
