{
  "$schema": "https://rangers-strike.dev/schema/card.schema.json",
  "id": "RS-587",
  "name": "怒りの鬼神　ガイ",
  "type": "unit",
  "category": "DA",
  "rarity": "N",
  "expansion": "legend1",
  "powerCost": 3,
  "text": "※これはBP3000以下のユニットにアタックされない。 【激しい闘争心】これ以外の自軍Sユニットを1体選び撃破してもよい。そうしたとき、相手は自分自身のユニットを1体選び撃破する。",
  "rawText": "※これはBP3000以下のユニットにアタックされない。 【激しい闘争心】これ以外の自軍Sユニットを1体選び撃破してもよい。そうしたとき、相手は自分自身のユニットを1体選び撃破する。",
  "bp": 2000,
  "size": "S",
  "comboNumber": 1,
  "features": [
    "アシュ",
    "男"
  ],
  "effects": [
    {
      "id": "no_attack_from_bp3000_or_less",
      "text": "※これはBP3000以下のユニットにアタックされない。",
      "trigger": {
        "type": "while_in_field"
      },
      "effects": [
        {
          "type": "grant_keyword",
          "keyword": "no_attack_from_bp3000_or_less",
          "duration": "permanent"
        }
      ]
    },
    {
      "id": "shii",
      "name": "激しい闘争心",
      "text": "これ以外の自軍Sユニットを1体選び撃破してもよい。そうしたとき、相手は自分自身のユニットを1体選び撃破する。",
      "trigger": {
        "type": "nc"
      },
      "effects": [
        {
          "type": "grant_keyword",
          "keyword": "opponent_must_korenosyunitowo1bi_geki_ha_shitemoyoisoushitatokihanoyuni",
          "duration": "turn"
        }
      ],
      "optional": true
    }
  ],
  "implementation": {
    "source": "dsl",
    "handler": "interpreter",
    "testGenerated": true
  },
  "imageUrl": "/cards/promoted/RS-587.jpg",
  "imageSourceUrl": "https://www.grnrngr.com/cards/rangers-strike/cards/RS-587.jpg"
}
