{
  "$schema": "https://rangers-strike.dev/schema/card.schema.json",
  "id": "RS-455",
  "name": "ニンジャブラック",
  "type": "unit",
  "category": "MA",
  "rarity": "R",
  "expansion": "legend1",
  "powerCost": 4,
  "text": "※これは「ブラックガンマー」としてつかえる。 ※これが自分の手札にある間、自軍ラッシュフェイズ中、自軍ダメージの数がこれの必要パワーの数字以上あれば、これを自軍ラッシュエリアに出してもよい。 【岩地獄の術】SPが空欄ではない敵軍Sユニットを自分の手札の枚数と同じ数まで選び、持ち主の山札の下に好きな順で戻してもよい。",
  "rawText": "※これは「ブラックガンマー」としてつかえる。 ※これが自分の手札にある間、自軍ラッシュフェイズ中、自軍ダメージの数がこれの必要パワーの数字以上あれば、これを自軍ラッシュエリアに出してもよい。 【岩地獄の術】SPが空欄ではない敵軍Sユニットを自分の手札の枚数と同じ数まで選び、持ち主の山札の下に好きな順で戻してもよい。",
  "bp": 3000,
  "size": "S",
  "comboNumber": 1,
  "features": [
    "ブラック",
    "男",
    "忍者"
  ],
  "effects": [
    {
      "id": "unnamed_alias_burakuganma",
      "text": "※これは「ブラックガンマー」としてつかえる。",
      "trigger": {
        "type": "while_in_field"
      },
      "effects": [
        {
          "type": "grant_keyword",
          "keyword": "alias_burakuganma",
          "duration": "permanent"
        }
      ]
    },
    {
      "id": "unnamed_while_in_hand_rush_deploy_damejinogakore",
      "text": "※これが自分の手札にある間、自軍ラッシュフェイズ中、自軍ダメージの数がこれの必要パワーの数字以上あれば、これを自軍ラッシュエリアに出してもよい。",
      "trigger": {
        "type": "while_in_field"
      },
      "effects": [
        {
          "type": "grant_keyword",
          "keyword": "while_in_hand_rush_deploy::damejinogakorenopawanoar",
          "duration": "permanent"
        }
      ],
      "optional": true
    },
    {
      "id": "no_e5b2a9",
      "name": "岩地獄の術",
      "text": "SPが空欄ではない敵軍Sユニットを自分の手札の枚数と同じ数まで選び、持ち主の山札の下に好きな順で戻してもよい。",
      "trigger": {
        "type": "nc"
      },
      "effects": [
        {
          "type": "grant_keyword",
          "keyword": "pick_remaining_spgadehanaisyunitowononotojimadebichinono",
          "duration": "turn"
        }
      ],
      "optional": true
    }
  ],
  "unnamedRules": [
    {
      "kind": "fusion",
      "text": "※これは「ブラックガンマー」としてつかえる。",
      "rule": "fusion_material_alias",
      "partnerCardIds": []
    }
  ],
  "implementation": {
    "source": "dsl",
    "handler": "interpreter",
    "testGenerated": true
  },
  "imageUrl": "/cards/promoted/RS-455.jpg",
  "imageSourceUrl": "https://www.grnrngr.com/cards/rangers-strike/cards/RS-455.jpg"
}
