{
  "$schema": "https://rangers-strike.dev/schema/card.schema.json",
  "id": "XG3-043",
  "name": "ライダーマン",
  "type": "unit",
  "category": "ET",
  "rarity": "N",
  "expansion": "legend1",
  "powerCost": 5,
  "text": "【プルトンロケット阻止】これが自軍エリアにある間、自軍ラッシュフェイズ中、これを捨札にして次の効果を発動できる⇒敵軍山札の上から5枚をオモテにする。そうしたとき、その中から常駐オペレーション以外のオペレーションカードを1枚選び捨札にする。その後、残りのカードを山札に戻してシャッフルする。",
  "rawText": "【プルトンロケット阻止】これが自軍エリアにある間、自軍ラッシュフェイズ中、これを捨札にして次の効果を発動できる⇒敵軍山札の上から5枚をオモテにする。そうしたとき、その中から常駐オペレーション以外のオペレーションカードを1枚選び捨札にする。その後、残りのカードを山札に戻してシャッフルする。",
  "bp": 1000,
  "size": "S",
  "sp": "1/5",
  "features": [
    "仮面ライダー",
    "男"
  ],
  "effects": [
    {
      "id": "purutonroketo",
      "name": "プルトンロケット阻止",
      "text": "これが自軍エリアにある間、自軍ラッシュフェイズ中、これを捨札にして次の効果を発動できる⇒敵軍山札の上から5枚をオモテにする。そうしたとき、その中から常駐オペレーション以外のオペレーションカードを1枚選び捨札にする。その後、残りのカードを山札に戻してシャッフルする。",
      "trigger": {
        "type": "while_in_field"
      },
      "optional": false,
      "effects": [
        {
          "type": "grant_keyword",
          "keyword": "xg3::XG3-043::pluton",
          "duration": "permanent"
        }
      ]
    }
  ],
  "implementation": {
    "source": "dsl",
    "handler": "interpreter",
    "testGenerated": true
  }
}
