{
  "$schema": "https://rangers-strike.dev/schema/card.schema.json",
  "id": "RS-520",
  "name": "スコープショット",
  "type": "operation",
  "category": "ET",
  "rarity": "N",
  "expansion": "legend1",
  "powerCost": 0,
  "text": "自軍山札から1枚ひいて、そのカードを自軍コマンドゾーンに置く。置けなければ手札に加える。",
  "rawText": "自軍山札から1枚ひいて、そのカードを自軍コマンドゾーンに置く。置けなければ手札に加える。",
  "effects": [
    {
      "id": "sukopushoto",
      "name": "スコープショット",
      "text": "自軍山札から1枚ひいて、そのカードを自軍コマンドゾーンに置く。置けなければ手札に加える。",
      "trigger": {
        "type": "operation",
        "timing": "rush"
      },
      "effects": [
        {
          "type": "grant_keyword",
          "keyword": "draw_deck_to_command_or_hand",
          "duration": "turn"
        }
      ],
      "optional": false
    }
  ],
  "implementation": {
    "source": "dsl",
    "handler": "interpreter",
    "testGenerated": true
  },
  "imageUrl": "/cards/promoted/RS-520.jpg",
  "imageSourceUrl": "https://www.grnrngr.com/cards/rangers-strike/cards/RS-520.jpg"
}
