{
  "$schema": "https://rangers-strike.dev/schema/card.schema.json",
  "id": "RK-238",
  "name": "キャッスルドラン",
  "type": "unit",
  "category": "MA",
  "rarity": "N",
  "expansion": "legend2",
  "powerCost": 1,
  "text": "※これは自軍コマンドを2つホールドしなければバトルエリアに出られない。 【魂の捕獲】これが自軍エリアにある間、特徴「仮面ライダー」を持つユニットがユニットを撃破して捨札にしたとき、その特徴「仮面ライダー」を持つユニットの持ち主は1枚ドローしてもよい。",
  "rawText": "※これは自軍コマンドを2つホールドしなければバトルエリアに出られない。 【魂の捕獲】これが自軍エリアにある間、特徴「仮面ライダー」を持つユニットがユニットを撃破して捨札にしたとき、その特徴「仮面ライダー」を持つユニットの持ち主は1枚ドローしてもよい。",
  "bp": 4000,
  "size": "M",
  "features": [
    "獣",
    "ドラゴン"
  ],
  "effects": [
    {
      "id": "require_command_hold_entry",
      "text": "※これは自軍コマンドを2つホールドしなければバトルエリアに出られない。",
      "trigger": {
        "type": "while_in_field"
      },
      "effects": [
        {
          "type": "grant_keyword",
          "keyword": "require_command_hold_entry",
          "duration": "permanent"
        }
      ]
    },
    {
      "id": "no_e9ad82",
      "name": "魂の捕獲",
      "text": "これが自軍エリアにある間、特徴「仮面ライダー」を持つユニットがユニットを撃破して捨札にしたとき、その特徴「仮面ライダー」を持つユニットの持ち主は1枚ドローしてもよい。",
      "trigger": {
        "type": "while_in_field"
      },
      "effects": [
        {
          "type": "grant_keyword",
          "keyword": "rk12::RK-238::soul_capture",
          "duration": "permanent"
        }
      ],
      "optional": true
    }
  ],
  "implementation": {
    "source": "dsl",
    "handler": "interpreter",
    "testGenerated": true
  },
  "imageUrl": "/cards/promoted/RK-238.jpg",
  "imageSourceUrl": "https://www.grnrngr.com/cards/rangers-strike/cards/RK-238.jpg",
  "unnamedRules": [
    {
      "kind": "note",
      "text": "※これは自軍コマンドを2つホールドしなければバトルエリアに出られない。",
      "rule": "battle_entry_hold",
      "holdCount": 2
    }
  ]
}
