{
  "$schema": "https://rangers-strike.dev/schema/card.schema.json",
  "id": "RS-183",
  "name": "黒子ロボの記憶操作",
  "type": "operation",
  "category": "MA",
  "rarity": "N",
  "expansion": "legend1",
  "powerCost": 2,
  "text": "この効果は、自分が行ったあとで相手も行う⇒3枚までドローする。そして、以下の手順を3回行う。自分の手札を相手に見せずに1枚選ばせ、選ばれたカードを自軍山札の上に戻す。ただし、自軍コマンドを1つホールドすれば戻さなくてもよい。",
  "rawText": "この効果は、自分が行ったあとで相手も行う⇒3枚までドローする。そして、以下の手順を3回行う。自分の手札を相手に見せずに1枚選ばせ、選ばれたカードを自軍山札の上に戻す。ただし、自軍コマンドを1つホールドすれば戻さなくてもよい。",
  "implementation": {
    "source": "dsl",
    "handler": "unimplemented",
    "testGenerated": true
  }
}
